{"protocol":"G3-ATOMIC-GRID-AUDIT-v1","pairId":"PAIR-KIT-GRID","judgeSlot":"SOL-ULTRA","cells":[{"cellId":"G01","singleCompositionUnit":true,"containsWholeFacilityOrRoute":false,"containsAtlasOrAlternatives":false,"evidenceBox":[31,228,236,509],"observation":"One independently placeable industrial hall is visible."},{"cellId":"G02","singleCompositionUnit":true,"containsWholeFacilityOrRoute":false,"containsAtlasOrAlternatives":false,"evidenceBox":[344,170,409,506],"observation":"One freestanding smokestack is visible."},{"cellId":"G03","singleCompositionUnit":true,"containsWholeFacilityOrRoute":false,"containsAtlasOrAlternatives":false,"evidenceBox":[514,230,721,500],"observation":"One independently placeable industrial hall is visible."},{"cellId":"G04","singleCompositionUnit":true,"containsWholeFacilityOrRoute":false,"containsAtlasOrAlternatives":false,"evidenceBox":[778,160,949,506],"observation":"One compact breaker bay on a shared base is visible."},{"cellId":"G05","singleCompositionUnit":true,"containsWholeFacilityOrRoute":false,"containsAtlasOrAlternatives":false,"evidenceBox":[47,622,221,968],"observation":"One transformer with integral bushings and cooling fins is visible."},{"cellId":"G06","singleCompositionUnit":true,"containsWholeFacilityOrRoute":false,"containsAtlasOrAlternatives":false,"evidenceBox":[335,591,428,939],"observation":"One lattice distribution tower is visible."},{"cellId":"G07","singleCompositionUnit":true,"containsWholeFacilityOrRoute":false,"containsAtlasOrAlternatives":false,"evidenceBox":[576,611,670,947],"observation":"One lattice transmission tower is visible."},{"cellId":"G08","singleCompositionUnit":true,"containsWholeFacilityOrRoute":false,"containsAtlasOrAlternatives":false,"evidenceBox":[761,689,966,951],"observation":"One crossing foundation is visible."}],"map":{"largeBakedGridFacilityRasterPresent":false,"atomicPlantAssemblyVisible":true,"individualPoleSpritesVisible":true,"plannedAmberAndEnergizedCyanDistinct":true,"evidenceBoxes":[[115,250,427,546],[323,398,516,565],[323,282,672,569],[161,417,661,861]],"observation":"Separate plant units and pole sprites accompany distinct amber and cyan network paths."},"criticalFailures":[],"verdict":"PASS"}